dataset_id,dataset_version,row_id,row_type,source_set,source_phase_or_file,project_slug,source_origin,source_url_or_report_url,report_evidence,source_path,contract,function,original_line_start,original_line_end,category,swc_id,severity,expected_root_cause,evidence_summary,safe_selection_reason,human_verified,verification_status,leakage_policy,provenance_notes
lbe-curated-unified,freeze-candidate-20260628-phase2z,v2:phase2m:safe:020:2024-08-chakra:SettlementSignatureVerifier.is_validator,safe,v2,Phase 2M,2024-08-chakra,code4rena,/Users/tonynguyen/Projects/poc_demo/data/knowledge_base/code4rena/2024-08-chakra,,solidity/handler/contracts/SettlementSignatureVerifier.sol,SettlementSignatureVerifier,is_validator,100,102,,,safe,,,Verified safe getter/view/pure function is_validator,true,accepted,exclude_project_from_kb_retrieval,accepted_v2_gold;assembled_from_phase2y_preview
lbe-curated-unified,freeze-candidate-20260628-phase2z,v2:phase2n:vuln:001:2022-01-openleverage:OpenLevV1Lib.doTransferOut,vuln,v2,Phase 2N,2022-01-openleverage,code4rena,/Users/tonynguyen/Projects/poc_demo/data/knowledge_base/code4rena/2022-01-openleverage/findings/H-01.md,H-01.md,openleverage-contracts/contracts/OpenLevV1Lib.sol,OpenLevV1Lib,doTransferOut,250,257,Denial of Service,SWC-113,high,Native transfer gas stipend can make wrapped native token withdrawals fail for smart contract receivers,Report H-01 shows doTransferOut uses payable transfer after WETH withdraw which can lock user withdrawals,,true,accepted,exclude_project_from_kb_retrieval,accepted_v2_gold;assembled_from_phase2y_preview
lbe-curated-unified,freeze-candidate-20260628-phase2z,v2:phase2n:vuln:002:2022-01-openleverage:UniV2ClassDex.uniClassSell,vuln,v2,Phase 2N,2022-01-openleverage,code4rena,/Users/tonynguyen/Projects/poc_demo/data/knowledge_base/code4rena/2022-01-openleverage/findings/M-01.md,M-01.md,openleverage-contracts/contracts/dex/bsc/UniV2ClassDex.sol,UniV2ClassDex,uniClassSell,31,56,Accounting,SWC-101,medium,Fee-on-transfer sell path checks computed output before measuring actual received tokens,Report M-01 shows uniClassSell does not fully support fee-on-transfer tokens because the computed amount drives validation,,true,accepted,exclude_project_from_kb_retrieval,accepted_v2_gold;assembled_from_phase2y_preview
lbe-curated-unified,freeze-candidate-20260628-phase2z,v2:phase2n:vuln:003:2022-01-openleverage:Timelock.executeTransaction,vuln,v2,Phase 2N,2022-01-openleverage,code4rena,/Users/tonynguyen/Projects/poc_demo/data/knowledge_base/code4rena/2022-01-openleverage/findings/M-03.md,M-03.md,openleverage-contracts/contracts/gov/Timelock.sol,Timelock,executeTransaction,117,143,Locked Funds,SWC-132,medium,Timelock execution forwards msg.value instead of using ETH already held by the Timelock,Report M-03 shows ETH sent to Timelock can remain locked because executeTransaction sends caller value,,true,accepted,exclude_project_from_kb_retrieval,accepted_v2_gold;assembled_from_phase2y_preview
lbe-curated-unified,freeze-candidate-20260628-phase2z,v2:phase2n:vuln:004:2022-01-openleverage:OpenLevV1.closeTrade,vuln,v2,Phase 2N,2022-01-openleverage,code4rena,/Users/tonynguyen/Projects/poc_demo/data/knowledge_base/code4rena/2022-01-openleverage/findings/M-04.md,M-04.md,openleverage-contracts/contracts/OpenLevV1.sol,OpenLevV1,closeTrade,168,225,Accounting,SWC-101,medium,V3 closeTrade repayment accounting trusts DEX returned amount for fee-on-transfer tokens,Report M-04 shows closeTrade can over-account received funds and freeze or drain value with taxed tokens,,true,accepted,exclude_project_from_kb_retrieval,accepted_v2_gold;assembled_from_phase2y_preview
lbe-curated-unified,freeze-candidate-20260628-phase2z,v2:phase2n:vuln:005:2022-01-timeswap:TimeswapPair.borrow,vuln,v2,Phase 2N,2022-01-timeswap,code4rena,/Users/tonynguyen/Projects/poc_demo/data/knowledge_base/code4rena/2022-01-timeswap/findings/H-01.md,H-01.md,Timeswap/Timeswap-V1-Core/contracts/TimeswapPair.sol,TimeswapPair,borrow,299,337,Accounting,SWC-101,high,User supplied zIncrease can inflate pool state z relative to actual collateral transferred,Report H-01 shows borrow lets an attacker increase pool.state.z with a small loan and reclaim collateral through pay,,true,accepted,exclude_project_from_kb_retrieval,accepted_v2_gold;assembled_from_phase2y_preview
lbe-curated-unified,freeze-candidate-20260628-phase2z,v2:phase2n:vuln:006:2022-01-timeswap:TimeswapPair.mint,vuln,v2,Phase 2N,2022-01-timeswap,code4rena,/Users/tonynguyen/Projects/poc_demo/data/knowledge_base/code4rena/2022-01-timeswap/findings/H-04.md,H-04.md,Timeswap/Timeswap-V1-Core/contracts/TimeswapPair.sol,TimeswapPair,mint,131,190,Reentrancy,SWC-107,high,External mint callback occurs before important pool state updates are completed,Report H-04 shows Callback.mint happens before reserves and debt state updates creating cross-function reentrancy risk,,true,accepted,exclude_project_from_kb_retrieval,accepted_v2_gold;assembled_from_phase2y_preview
lbe-curated-unified,freeze-candidate-20260628-phase2z,v2:phase2n:vuln:007:2022-01-timeswap:TimeswapPair.lend,vuln,v2,Phase 2N,2022-01-timeswap,code4rena,/Users/tonynguyen/Projects/poc_demo/data/knowledge_base/code4rena/2022-01-timeswap/findings/H-05.md,H-05.md,Timeswap/Timeswap-V1-Core/contracts/TimeswapPair.sol,TimeswapPair,lend,224,261,Reentrancy,SWC-107,high,External lend callback occurs before claims and reserve state updates are completed,Report H-05 shows Callback.lend is called before totalClaims and reserve updates creating cross-function reentrancy risk,,true,accepted,exclude_project_from_kb_retrieval,accepted_v2_gold;assembled_from_phase2y_preview
lbe-curated-unified,freeze-candidate-20260628-phase2z,v2:phase2n:vuln:008:2022-01-timeswap:TimeswapPair.pay,vuln,v2,Phase 2N,2022-01-timeswap,code4rena,/Users/tonynguyen/Projects/poc_demo/data/knowledge_base/code4rena/2022-01-timeswap/findings/H-07.md,H-07.md,Timeswap/Timeswap-V1-Core/contracts/TimeswapPair.sol,TimeswapPair,pay,341,377,Reentrancy,SWC-107,high,External pay callback occurs before reserve state updates are completed,Report H-07 shows Callback.pay executes before reserve asset and collateral updates creating cross-function reentrancy risk,,true,accepted,exclude_project_from_kb_retrieval,accepted_v2_gold;assembled_from_phase2y_preview
lbe-curated-unified,freeze-candidate-20260628-phase2z,v2:phase2n:vuln:009:2022-01-notional:TreasuryAction.claimCOMPAndTransfer,vuln,v2,Phase 2N,2022-01-notional,code4rena,/Users/tonynguyen/Projects/poc_demo/data/knowledge_base/code4rena/2022-01-notional/findings/H-01.md,H-01.md,contracts/TreasuryAction.sol,TreasuryAction,claimCOMPAndTransfer,96,115,Locked Funds,SWC-135,high,COMP accounting uses pre and post claim balances so externally claimed COMP remains stuck,Report H-01 shows claimCOMPAndTransfer can leave COMP unrecoverable after anyone claims COMP for the contract,,true,accepted,exclude_project_from_kb_retrieval,accepted_v2_gold;assembled_from_phase2y_preview
lbe-curated-unified,freeze-candidate-20260628-phase2z,v2:phase2n:vuln:010:2022-01-notional:sNOTE.startCoolDown,vuln,v2,Phase 2N,2022-01-notional,code4rena,/Users/tonynguyen/Projects/poc_demo/data/knowledge_base/code4rena/2022-01-notional/findings/H-02.md,H-02.md,contracts/sNOTE.sol,sNOTE,startCoolDown,217,225,Business Logic,SWC-135,high,Cooldown is account-wide and not bound to the balance that existed when the window started,Report H-02 shows startCoolDown allows later deposits to bypass the intended redeem delay,,true,accepted,exclude_project_from_kb_retrieval,accepted_v2_gold;assembled_from_phase2y_preview
lbe-curated-unified,freeze-candidate-20260628-phase2z,v2:phase2n:vuln:011:2022-01-notional:EIP1271Wallet._validateOrder,vuln,v2,Phase 2N,2022-01-notional,code4rena,/Users/tonynguyen/Projects/poc_demo/data/knowledge_base/code4rena/2022-01-notional/findings/H-03.md,H-03.md,contracts/utils/EIP1271Wallet.sol,EIP1271Wallet,_validateOrder,147,188,Input Validation,SWC-123,high,Order validation omits makerFee and takerFee zero checks for signed 0x orders,Report H-03 shows _validateOrder allows malicious manager orders that burn treasury value through fees,,true,accepted,exclude_project_from_kb_retrieval,accepted_v2_gold;assembled_from_phase2y_preview
lbe-curated-unified,freeze-candidate-20260628-phase2z,v2:phase2n:vuln:012:2022-01-notional:sNOTE._mintFromAssets,vuln,v2,Phase 2N,2022-01-notional,code4rena,/Users/tonynguyen/Projects/poc_demo/data/knowledge_base/code4rena/2022-01-notional/findings/M-02.md,M-02.md,contracts/sNOTE.sol,sNOTE,_mintFromAssets,190,214,Slippage,SWC-114,medium,Balancer join hardcodes minimum BPT output to zero and exposes minting to slippage,Report M-02 shows _mintFromAssets accepts any BPT amount because min output is hardcoded to 0,,true,accepted,exclude_project_from_kb_retrieval,accepted_v2_gold;assembled_from_phase2y_preview
lbe-curated-unified,freeze-candidate-20260628-phase2z,v2:phase2n:vuln:013:2022-01-trader-joe:LaunchEvent.emergencyWithdraw,vuln,v2,Phase 2N,2022-01-trader-joe,code4rena,/Users/tonynguyen/Projects/poc_demo/data/knowledge_base/code4rena/2022-01-trader-joe/findings/H-01.md,H-01.md,contracts/LaunchEvent.sol,LaunchEvent,emergencyWithdraw,493,516,Denial of Service,SWC-113,high,Emergency withdrawals after pair creation try to return WAVAX even though reserves were consumed for liquidity,Report H-01 shows emergencyWithdraw can revert or strand user value after createPair sets wavaxReserve to zero,,true,accepted,exclude_project_from_kb_retrieval,accepted_v2_gold;assembled_from_phase2y_preview
lbe-curated-unified,freeze-candidate-20260628-phase2z,v2:phase2n:vuln:014:2022-01-trader-joe:LaunchEvent.createPair,vuln,v2,Phase 2N,2022-01-trader-joe,code4rena,/Users/tonynguyen/Projects/poc_demo/data/knowledge_base/code4rena/2022-01-trader-joe/findings/H-02.md,H-02.md,contracts/LaunchEvent.sol,LaunchEvent,createPair,377,424,Arithmetic,SWC-101,high,Token allocation uses token decimals instead of 1e18 precision when floor price is not reached,Report H-02 shows createPair computes tokenAllocated incorrectly for tokens with decimals other than 18,,true,accepted,exclude_project_from_kb_retrieval,accepted_v2_gold;assembled_from_phase2y_preview
lbe-curated-unified,freeze-candidate-20260628-phase2z,v2:phase2n:vuln:015:2022-01-trader-joe:LaunchEvent.createPair,vuln,v2,Phase 2N,2022-01-trader-joe,code4rena,/Users/tonynguyen/Projects/poc_demo/data/knowledge_base/code4rena/2022-01-trader-joe/findings/M-02.md,M-02.md,contracts/LaunchEvent.sol,LaunchEvent,createPair,377,389,Denial of Service,SWC-113,medium,Existing nonzero AMM pair can prevent LaunchEvent from creating the required pair,Report M-02 shows createPair can be denied by pre-creating a liquid pair which blocks later withdrawals,,true,accepted,exclude_project_from_kb_retrieval,accepted_v2_gold;assembled_from_phase2y_preview
lbe-curated-unified,freeze-candidate-20260628-phase2z,v2:phase2n:vuln:016:2022-01-trader-joe:RocketJoeStaking.updatePool,vuln,v2,Phase 2N,2022-01-trader-joe,code4rena,/Users/tonynguyen/Projects/poc_demo/data/knowledge_base/code4rena/2022-01-trader-joe/findings/M-04.md,M-04.md,contracts/RocketJoeStaking.sol,RocketJoeStaking,updatePool,158,176,Accounting,SWC-135,medium,Uninitialized lastRewardTimestamp lets direct JOE transfers inflate rJOE rewards on first update,Report M-04 shows updatePool can mint excessive rJOE when JOE is sent before initialization of reward time,,true,accepted,exclude_project_from_kb_retrieval,accepted_v2_gold;assembled_from_phase2y_preview
lbe-curated-unified,freeze-candidate-20260628-phase2z,v2:phase2n:vuln:017:2022-02-aave-lens:FeeCollectModule.initializePublicationCollectModule,vuln,v2,Phase 2N,2022-02-aave-lens,code4rena,/Users/tonynguyen/Projects/poc_demo/data/knowledge_base/code4rena/2022-02-aave-lens/findings/M-01.md,M-01.md,contracts/core/modules/collect/FeeCollectModule.sol,FeeCollectModule,initializePublicationCollectModule,59,80,Input Validation,SWC-123,medium,Fee amount validation reuses BPS_MAX as a nominal minimum across currencies with different decimals,Report M-01 shows initializePublicationCollectModule rejects low nominal fees because amount must be at least BPS_MAX,,true,accepted,exclude_project_from_kb_retrieval,accepted_v2_gold;assembled_from_phase2y_preview
lbe-curated-unified,freeze-candidate-20260628-phase2z,v2:phase2n:vuln:018:2022-02-aave-lens:FeeCollectModule._processCollectWithReferral,vuln,v2,Phase 2N,2022-02-aave-lens,code4rena,/Users/tonynguyen/Projects/poc_demo/data/knowledge_base/code4rena/2022-02-aave-lens/findings/M-02.md,M-02.md,contracts/core/modules/collect/FeeCollectModule.sol,FeeCollectModule,_processCollectWithReferral,139,176,Denial of Service,SWC-113,medium,Referral recipient lookup calls ownerOf on burned profile IDs and can revert valid mirror collects,Report M-02 shows _processCollectWithReferral fails when referrerProfileId has been burned,,true,accepted,exclude_project_from_kb_retrieval,accepted_v2_gold;assembled_from_phase2y_preview
lbe-curated-unified,freeze-candidate-20260628-phase2z,v2:phase2n:vuln:019:2022-02-aave-lens:InteractionLogic.follow,vuln,v2,Phase 2N,2022-02-aave-lens,code4rena,/Users/tonynguyen/Projects/poc_demo/data/knowledge_base/code4rena/2022-02-aave-lens/findings/M-07.md,M-07.md,contracts/libraries/InteractionLogic.sol,InteractionLogic,follow,38,75,Business Logic,SWC-135,medium,Deleted profile check only verifies handle existence and not that the handle maps to the requested profile ID,Report M-07 shows follow can follow a deleted profile after the same handle is recreated,,true,accepted,exclude_project_from_kb_retrieval,accepted_v2_gold;assembled_from_phase2y_preview
lbe-curated-unified,freeze-candidate-20260628-phase2z,v2:phase2n:vuln:020:2022-02-aave-lens:LensHub._createComment,vuln,v2,Phase 2N,2022-02-aave-lens,code4rena,/Users/tonynguyen/Projects/poc_demo/data/knowledge_base/code4rena/2022-02-aave-lens/findings/M-13.md,M-13.md,contracts/core/LensHub.sol,LensHub,_createComment,878,887,Reentrancy,SWC-107,medium,Publication count is incremented after external module logic which enables reentrant comment overwrite behavior,Report M-13 shows _createComment passes pubCount plus one before incrementing state after external logic,,true,accepted,exclude_project_from_kb_retrieval,accepted_v2_gold;assembled_from_phase2y_preview
lbe-curated-unified,freeze-candidate-20260628-phase2z,v2:phase2n:safe:001:2022-01-openleverage:Airdrop.verifyClaim,safe,v2,Phase 2N,2022-01-openleverage,code4rena,/Users/tonynguyen/Projects/poc_demo/data/knowledge_base/code4rena/2022-01-openleverage,,openleverage-contracts/contracts/Airdrop.sol,Airdrop,verifyClaim,71,73,,,safe,,,Verified production view helper that only checks a Merkle claim proof and has no judged-finding name overlap,true,accepted,exclude_project_from_kb_retrieval,accepted_v2_gold;assembled_from_phase2y_preview
lbe-curated-unified,freeze-candidate-20260628-phase2z,v2:phase2n:safe:002:2022-01-openleverage:ControllerV1.marginTradeAllowed,safe,v2,Phase 2N,2022-01-openleverage,code4rena,/Users/tonynguyen/Projects/poc_demo/data/knowledge_base/code4rena/2022-01-openleverage,,openleverage-contracts/contracts/ControllerV1.sol,ControllerV1,marginTradeAllowed,147,149,,,safe,,,Verified production view gate that only reads market suspension state and has no judged-finding name overlap,true,accepted,exclude_project_from_kb_retrieval,accepted_v2_gold;assembled_from_phase2y_preview
lbe-curated-unified,freeze-candidate-20260628-phase2z,v2:phase2n:safe:003:2022-01-openleverage:ControllerV1.lastTimeRewardApplicable,safe,v2,Phase 2N,2022-01-openleverage,code4rena,/Users/tonynguyen/Projects/poc_demo/data/knowledge_base/code4rena/2022-01-openleverage,,openleverage-contracts/contracts/ControllerV1.sol,ControllerV1,lastTimeRewardApplicable,205,207,,,safe,,,Verified production view reward timestamp helper and no judged-finding name overlap was found,true,accepted,exclude_project_from_kb_retrieval,accepted_v2_gold;assembled_from_phase2y_preview
lbe-curated-unified,freeze-candidate-20260628-phase2z,v2:phase2n:safe:004:2022-01-openleverage:LPool.getCash,safe,v2,Phase 2N,2022-01-openleverage,code4rena,/Users/tonynguyen/Projects/poc_demo/data/knowledge_base/code4rena/2022-01-openleverage,,openleverage-contracts/contracts/liquidity/LPool.sol,LPool,getCash,549,550,,,safe,,,Verified production view getter for underlying token cash balance with no judged-finding name overlap,true,accepted,exclude_project_from_kb_retrieval,accepted_v2_gold;assembled_from_phase2y_preview
lbe-curated-unified,freeze-candidate-20260628-phase2z,v2:phase2n:safe:005:2022-01-openleverage:OpenLevV1Lib.amountToShare,safe,v2,Phase 2N,2022-01-openleverage,code4rena,/Users/tonynguyen/Projects/poc_demo/data/knowledge_base/code4rena/2022-01-openleverage,,openleverage-contracts/contracts/OpenLevV1Lib.sol,OpenLevV1Lib,amountToShare,275,277,,,safe,,,Verified production pure accounting helper not named in judged findings and not part of the accepted vulnerable statements,true,accepted,exclude_project_from_kb_retrieval,accepted_v2_gold;assembled_from_phase2y_preview
lbe-curated-unified,freeze-candidate-20260628-phase2z,v2:phase2n:safe:006:2022-01-timeswap:TimeswapPair.totalReserves,safe,v2,Phase 2N,2022-01-timeswap,code4rena,/Users/tonynguyen/Projects/poc_demo/data/knowledge_base/code4rena/2022-01-timeswap,,Timeswap/Timeswap-V1-Core/contracts/TimeswapPair.sol,TimeswapPair,totalReserves,63,65,,,safe,,,Verified production view getter returning pool reserves and no function-name overlap with judged findings,true,accepted,exclude_project_from_kb_retrieval,accepted_v2_gold;assembled_from_phase2y_preview
lbe-curated-unified,freeze-candidate-20260628-phase2z,v2:phase2n:safe:007:2022-01-timeswap:TimeswapPair.liquidityOf,safe,v2,Phase 2N,2022-01-timeswap,code4rena,/Users/tonynguyen/Projects/poc_demo/data/knowledge_base/code4rena/2022-01-timeswap,,Timeswap/Timeswap-V1-Core/contracts/TimeswapPair.sol,TimeswapPair,liquidityOf,73,75,,,safe,,,Verified production view getter returning account liquidity and no judged-finding name overlap,true,accepted,exclude_project_from_kb_retrieval,accepted_v2_gold;assembled_from_phase2y_preview
lbe-curated-unified,freeze-candidate-20260628-phase2z,v2:phase2n:safe:008:2022-01-timeswap:TimeswapPair.claimsOf,safe,v2,Phase 2N,2022-01-timeswap,code4rena,/Users/tonynguyen/Projects/poc_demo/data/knowledge_base/code4rena/2022-01-timeswap,,Timeswap/Timeswap-V1-Core/contracts/TimeswapPair.sol,TimeswapPair,claimsOf,83,85,,,safe,,,Verified production view getter returning account claims and no judged-finding name overlap,true,accepted,exclude_project_from_kb_retrieval,accepted_v2_gold;assembled_from_phase2y_preview
lbe-curated-unified,freeze-candidate-20260628-phase2z,v2:phase2n:safe:009:2022-01-timeswap:TimeswapPair.dueOf,safe,v2,Phase 2N,2022-01-timeswap,code4rena,/Users/tonynguyen/Projects/poc_demo/data/knowledge_base/code4rena/2022-01-timeswap,,Timeswap/Timeswap-V1-Core/contracts/TimeswapPair.sol,TimeswapPair,dueOf,93,95,,,safe,,,Verified production view getter returning stored due data and no judged-finding name overlap,true,accepted,exclude_project_from_kb_retrieval,accepted_v2_gold;assembled_from_phase2y_preview
lbe-curated-unified,freeze-candidate-20260628-phase2z,v2:phase2n:safe:010:2022-01-notional:sNOTE.getPoolTokenShare,safe,v2,Phase 2N,2022-01-notional,code4rena,/Users/tonynguyen/Projects/poc_demo/data/knowledge_base/code4rena/2022-01-notional,,contracts/sNOTE.sol,sNOTE,getPoolTokenShare,257,260,,,safe,,,Verified production view getter for BPT claim share and no judged-finding name overlap,true,accepted,exclude_project_from_kb_retrieval,accepted_v2_gold;assembled_from_phase2y_preview
lbe-curated-unified,freeze-candidate-20260628-phase2z,v2:phase2n:safe:011:2022-01-notional:sNOTE.poolTokenShareOf,safe,v2,Phase 2N,2022-01-notional,code4rena,/Users/tonynguyen/Projects/poc_demo/data/knowledge_base/code4rena/2022-01-notional,,contracts/sNOTE.sol,sNOTE,poolTokenShareOf,264,265,,,safe,,,Verified production view getter for account pool-token share and no judged-finding name overlap,true,accepted,exclude_project_from_kb_retrieval,accepted_v2_gold;assembled_from_phase2y_preview
lbe-curated-unified,freeze-candidate-20260628-phase2z,v2:phase2n:safe:012:2022-01-notional:Bitmap.isBitSet,safe,v2,Phase 2N,2022-01-notional,code4rena,/Users/tonynguyen/Projects/poc_demo/data/knowledge_base/code4rena/2022-01-notional,,contracts/math/Bitmap.sol,Bitmap,isBitSet,27,29,,,safe,,,Verified production pure bitmap helper and no judged-finding name overlap,true,accepted,exclude_project_from_kb_retrieval,accepted_v2_gold;assembled_from_phase2y_preview
lbe-curated-unified,freeze-candidate-20260628-phase2z,v2:phase2n:safe:013:2022-01-notional:Bitmap.totalBitsSet,safe,v2,Phase 2N,2022-01-notional,code4rena,/Users/tonynguyen/Projects/poc_demo/data/knowledge_base/code4rena/2022-01-notional,,contracts/math/Bitmap.sol,Bitmap,totalBitsSet,33,42,,,safe,,,Verified production pure bitmap counting helper and no judged-finding name overlap,true,accepted,exclude_project_from_kb_retrieval,accepted_v2_gold;assembled_from_phase2y_preview
lbe-curated-unified,freeze-candidate-20260628-phase2z,v2:phase2n:safe:014:2022-01-trader-joe:RocketJoeFactory.numLaunchEvents,safe,v2,Phase 2N,2022-01-trader-joe,code4rena,/Users/tonynguyen/Projects/poc_demo/data/knowledge_base/code4rena/2022-01-trader-joe,,contracts/RocketJoeFactory.sol,RocketJoeFactory,numLaunchEvents,76,78,,,safe,,,Verified production view getter for launch-event count and no judged-finding name overlap,true,accepted,exclude_project_from_kb_retrieval,accepted_v2_gold;assembled_from_phase2y_preview
lbe-curated-unified,freeze-candidate-20260628-phase2z,v2:phase2n:safe:015:2022-01-trader-joe:LaunchEvent.getRJoeAmount,safe,v2,Phase 2N,2022-01-trader-joe,code4rena,/Users/tonynguyen/Projects/poc_demo/data/knowledge_base/code4rena/2022-01-trader-joe,,contracts/LaunchEvent.sol,LaunchEvent,getRJoeAmount,574,575,,,safe,,,Verified production view helper for rJOE deposit requirement and no judged-finding name overlap,true,accepted,exclude_project_from_kb_retrieval,accepted_v2_gold;assembled_from_phase2y_preview
lbe-curated-unified,freeze-candidate-20260628-phase2z,v2:phase2n:safe:016:2022-01-trader-joe:RocketJoeStaking.pendingRJoe,safe,v2,Phase 2N,2022-01-trader-joe,code4rena,/Users/tonynguyen/Projects/poc_demo/data/knowledge_base/code4rena/2022-01-trader-joe,,contracts/RocketJoeStaking.sol,RocketJoeStaking,pendingRJoe,81,92,,,safe,,,Verified production view getter for pending rewards and no judged-finding name overlap,true,accepted,exclude_project_from_kb_retrieval,accepted_v2_gold;assembled_from_phase2y_preview
lbe-curated-unified,freeze-candidate-20260628-phase2z,v2:phase2n:safe:017:2022-02-aave-lens:ModuleGlobals.isCurrencyWhitelisted,safe,v2,Phase 2N,2022-02-aave-lens,code4rena,/Users/tonynguyen/Projects/poc_demo/data/knowledge_base/code4rena/2022-02-aave-lens,,contracts/core/modules/ModuleGlobals.sol,ModuleGlobals,isCurrencyWhitelisted,70,72,,,safe,,,Verified production view getter for currency whitelist state and no judged-finding name overlap,true,accepted,exclude_project_from_kb_retrieval,accepted_v2_gold;assembled_from_phase2y_preview
lbe-curated-unified,freeze-candidate-20260628-phase2z,v2:phase2n:safe:018:2022-02-aave-lens:ModuleGlobals.getGovernance,safe,v2,Phase 2N,2022-02-aave-lens,code4rena,/Users/tonynguyen/Projects/poc_demo/data/knowledge_base/code4rena/2022-02-aave-lens,,contracts/core/modules/ModuleGlobals.sol,ModuleGlobals,getGovernance,75,77,,,safe,,,Verified production view getter for module governance address and no judged-finding name overlap,true,accepted,exclude_project_from_kb_retrieval,accepted_v2_gold;assembled_from_phase2y_preview
lbe-curated-unified,freeze-candidate-20260628-phase2z,v2:phase2n:safe:019:2022-02-aave-lens:ModuleGlobals.getTreasury,safe,v2,Phase 2N,2022-02-aave-lens,code4rena,/Users/tonynguyen/Projects/poc_demo/data/knowledge_base/code4rena/2022-02-aave-lens,,contracts/core/modules/ModuleGlobals.sol,ModuleGlobals,getTreasury,80,82,,,safe,,,Verified production view getter for treasury address and no judged-finding name overlap,true,accepted,exclude_project_from_kb_retrieval,accepted_v2_gold;assembled_from_phase2y_preview
lbe-curated-unified,freeze-candidate-20260628-phase2z,v2:phase2n:safe:020:2022-02-aave-lens:ModuleGlobals.getTreasuryFee,safe,v2,Phase 2N,2022-02-aave-lens,code4rena,/Users/tonynguyen/Projects/poc_demo/data/knowledge_base/code4rena/2022-02-aave-lens,,contracts/core/modules/ModuleGlobals.sol,ModuleGlobals,getTreasuryFee,85,87,,,safe,,,Verified production view getter for treasury fee and no judged-finding name overlap,true,accepted,exclude_project_from_kb_retrieval,accepted_v2_gold;assembled_from_phase2y_preview
lbe-curated-unified,freeze-candidate-20260628-phase2z,v2:phase2o:vuln:001:2022-02-concur:MasterChef.add,vuln,v2,Phase 2O,2022-02-concur,code4rena,/Users/tonynguyen/Projects/poc_demo/data/knowledge_base/code4rena/2022-02-concur/findings/H-01.md,H-01.md,contracts/MasterChef.sol,MasterChef,add,86,101,Accounting,SWC-101,high,Pool allocation changes without updating existing pools cause stale reward accounting,Report H-01 shows add updates totalAllocPoint without massUpdatePools so prior pools underpay stakers,,true,accepted,exclude_project_from_kb_retrieval,accepted_v2_gold;assembled_from_phase2y_preview
lbe-curated-unified,freeze-candidate-20260628-phase2z,v2:phase2o:vuln:002:2022-02-concur:MasterChef.deposit,vuln,v2,Phase 2O,2022-02-concur,code4rena,/Users/tonynguyen/Projects/poc_demo/data/knowledge_base/code4rena/2022-02-concur/findings/H-02.md,H-02.md,contracts/MasterChef.sol,MasterChef,deposit,157,180,Locked Funds,SWC-132,high,Deposit fee is removed from credited amount but never transferred or assigned,Report H-02 shows deposit subtracts depositFee from user amount but leaves the fee locked,,true,accepted,exclude_project_from_kb_retrieval,accepted_v2_gold;assembled_from_phase2y_preview
