dataset_id,dataset_version,row_id,row_type,source_set,source_phase_or_file,project_slug,source_origin,source_url_or_report_url,report_evidence,source_path,contract,function,original_line_start,original_line_end,category,swc_id,severity,expected_root_cause,evidence_summary,safe_selection_reason,human_verified,verification_status,leakage_policy,provenance_notes
lbe-curated-unified,freeze-candidate-20260628-phase2z,v2:phase2t:vuln:013:2024-07-karak:NativeVault.initialize,vuln,v2,Phase 2T,2024-07-karak,code4rena,/Users/tonynguyen/Projects/poc_demo/data/knowledge_base/code4rena/2024-07-karak/findings/H-02.md,H-02.md,src/NativeVault.sol,NativeVault,initialize,46,75,Access Control,SWC-105,high,NativeVault initialization accepts manager slashStore and nodeImplementation from unvalidated operator-supplied extraData,Report H-02 states operators can deploy an unslashable NativeVault because NativeVault.initialize trusts extraData values such as slashStore,,true,accepted,exclude_project_from_kb_retrieval,accepted_v2_gold;assembled_from_phase2y_preview
lbe-curated-unified,freeze-candidate-20260628-phase2z,v2:phase2t:vuln:014:2024-07-karak:NativeVault._transferToSlashStore,vuln,v2,Phase 2T,2024-07-karak,code4rena,/Users/tonynguyen/Projects/poc_demo/data/knowledge_base/code4rena/2024-07-karak/findings/H-03.md,H-03.md,src/NativeVault.sol,NativeVault,_transferToSlashStore,425,446,Arithmetic Precision,SWC-101,high,Rounding can make convertToAssets exceed totalRestakedETH and underflow the slashedAssets subtraction,Report H-03 maps snapshot DoS to NativeVault._transferToSlashStore where slashedAssets subtracts convertToAssets from node.totalRestakedETH,,true,accepted,exclude_project_from_kb_retrieval,accepted_v2_gold;assembled_from_phase2y_preview
lbe-curated-unified,freeze-candidate-20260628-phase2z,v2:phase2t:vuln:015:2024-07-karak:SlasherLib.fetchEarmarkedStakes,vuln,v2,Phase 2T,2024-07-karak,code4rena,/Users/tonynguyen/Projects/poc_demo/data/knowledge_base/code4rena/2024-07-karak/findings/M-04.md,M-04.md,src/entities/SlasherLib.sol,SlasherLib,fetchEarmarkedStakes,79,92,Slashing Logic,SWC-123,medium,Queued slashing earmarks stake from totalAssets at request time without excluding pending withdrawal exposure or warning depositors,Report M-04 states delayed slashing can unfairly affect later depositors because fetchEarmarkedStakes records slashes from vault totalAssets during the request window,,true,accepted,exclude_project_from_kb_retrieval,accepted_v2_gold;assembled_from_phase2y_preview
lbe-curated-unified,freeze-candidate-20260628-phase2z,v2:phase2t:vuln:016:2024-07-karak:Vault.slashAssets,vuln,v2,Phase 2T,2024-07-karak,code4rena,/Users/tonynguyen/Projects/poc_demo/data/knowledge_base/code4rena/2024-07-karak/findings/M-05.md,M-05.md,src/Vault.sol,Vault,slashAssets,193,205,Denial of Service,SWC-113,medium,slashAssets forwards zero transferAmount to the slashing handler when totalAssets is zero causing finalization to revert,Report M-05 states Vault.slashAssets can make a whole slashing finalization fail because zero transferAmount still calls handleSlashing,,true,accepted,exclude_project_from_kb_retrieval,accepted_v2_gold;assembled_from_phase2y_preview
lbe-curated-unified,freeze-candidate-20260628-phase2z,v2:phase2t:vuln:017:2024-08-wildcat:WildcatMarketWithdrawals._executeWithdrawal,vuln,v2,Phase 2T,2024-08-wildcat,code4rena,/Users/tonynguyen/Projects/poc_demo/data/knowledge_base/code4rena/2024-08-wildcat/findings/H-01.md,H-01.md,src/market/WildcatMarketWithdrawals.sol,WildcatMarketWithdrawals,_executeWithdrawal,231,280,Accounting Precision,SWC-101,high,Closed markets allow withdrawal execution before all batch requests are known while payout ratio uses mutable batch totals,Report H-01 states _executeWithdrawal computes payout from batch.normalizedAmountPaid and batch.scaledTotalAmount allowing early closed-market executions to break withdrawal accounting,,true,accepted,exclude_project_from_kb_retrieval,accepted_v2_gold;assembled_from_phase2y_preview
lbe-curated-unified,freeze-candidate-20260628-phase2z,v2:phase2t:vuln:018:2024-08-wildcat:FixedTermLoanHooks.onSetAnnualInterestAndReserveRatioBips,vuln,v2,Phase 2T,2024-08-wildcat,code4rena,/Users/tonynguyen/Projects/poc_demo/data/knowledge_base/code4rena/2024-08-wildcat/findings/M-02.md,M-02.md,src/access/FixedTermLoanHooks.sol,FixedTermLoanHooks,onSetAnnualInterestAndReserveRatioBips,960,978,Business Logic,SWC-123,medium,FixedTermLoanHooks forwards APR updates without checking whether the fixed term has ended,Report M-02 states onSetAnnualInterestAndReserveRatioBips lets borrowers reduce APR before fixedTermEndTime while lenders cannot withdraw,,true,accepted,exclude_project_from_kb_retrieval,accepted_v2_gold;assembled_from_phase2y_preview
lbe-curated-unified,freeze-candidate-20260628-phase2z,v2:phase2t:vuln:019:2024-08-wildcat:WildcatMarket.closeMarket,vuln,v2,Phase 2T,2024-08-wildcat,code4rena,/Users/tonynguyen/Projects/poc_demo/data/knowledge_base/code4rena/2024-08-wildcat/findings/M-03.md,M-03.md,src/market/WildcatMarket.sol,WildcatMarket,closeMarket,226,245,Accounting Logic,SWC-123,medium,closeMarket updates state before pulling remaining debt which differs from repay paths and can charge extra fees,Report M-03 states closeMarket fetches updated state before repayment while repay pulls funds first causing inconsistent and higher borrower fees,,true,accepted,exclude_project_from_kb_retrieval,accepted_v2_gold;assembled_from_phase2y_preview
lbe-curated-unified,freeze-candidate-20260628-phase2z,v2:phase2t:vuln:020:2024-08-wildcat:AccessControlHooks.onQueueWithdrawal,vuln,v2,Phase 2T,2024-08-wildcat,code4rena,/Users/tonynguyen/Projects/poc_demo/data/knowledge_base/code4rena/2024-08-wildcat/findings/M-08.md,M-08.md,src/access/AccessControlHooks.sol,AccessControlHooks,onQueueWithdrawal,812,825,Access Control,SWC-105,medium,onQueueWithdrawal lacks the hooked-market caller check used by comparable hooks before validating lender credentials,Report M-08 states AccessControlHooks.onQueueWithdrawal can be called by arbitrary senders and forward hooksData into credential validation,,true,accepted,exclude_project_from_kb_retrieval,accepted_v2_gold;assembled_from_phase2y_preview
lbe-curated-unified,freeze-candidate-20260628-phase2z,v2:phase2t:safe:001:2021-05-yield:Pool.getK,safe,v2,Phase 2T,2021-05-yield,code4rena,/Users/tonynguyen/Projects/poc_demo/data/knowledge_base/code4rena/2021-05-yield,,contracts/yieldspace/Pool.sol,Pool,getK,114,117,,,safe,,,Verified production view getter returning the pool k parameter and not named in judged findings,true,accepted,exclude_project_from_kb_retrieval,accepted_v2_gold;assembled_from_phase2y_preview
lbe-curated-unified,freeze-candidate-20260628-phase2z,v2:phase2t:safe:002:2021-05-yield:Pool.getG1,safe,v2,Phase 2T,2021-05-yield,code4rena,/Users/tonynguyen/Projects/poc_demo/data/knowledge_base/code4rena/2021-05-yield,,contracts/yieldspace/Pool.sol,Pool,getG1,120,122,,,safe,,,Verified production view getter returning the pool g1 parameter and not named in judged findings,true,accepted,exclude_project_from_kb_retrieval,accepted_v2_gold;assembled_from_phase2y_preview
lbe-curated-unified,freeze-candidate-20260628-phase2z,v2:phase2t:safe:003:2021-05-yield:Pool.getG2,safe,v2,Phase 2T,2021-05-yield,code4rena,/Users/tonynguyen/Projects/poc_demo/data/knowledge_base/code4rena/2021-05-yield,,contracts/yieldspace/Pool.sol,Pool,getG2,125,127,,,safe,,,Verified production view getter returning the pool g2 parameter and not named in judged findings,true,accepted,exclude_project_from_kb_retrieval,accepted_v2_gold;assembled_from_phase2y_preview
lbe-curated-unified,freeze-candidate-20260628-phase2z,v2:phase2t:safe:004:2021-05-yield:Pool.getCache,safe,v2,Phase 2T,2021-05-yield,code4rena,/Users/tonynguyen/Projects/poc_demo/data/knowledge_base/code4rena/2021-05-yield,,contracts/yieldspace/Pool.sol,Pool,getCache,140,142,,,safe,,,Verified production view getter returning cached pool balances and timestamp with no judged-finding function overlap,true,accepted,exclude_project_from_kb_retrieval,accepted_v2_gold;assembled_from_phase2y_preview
lbe-curated-unified,freeze-candidate-20260628-phase2z,v2:phase2t:safe:005:2024-05-predy:Math.fullMulDivInt256,safe,v2,Phase 2T,2024-05-predy,code4rena,/Users/tonynguyen/Projects/poc_demo/data/knowledge_base/code4rena/2024-05-predy,,src/libraries/math/Math.sol,Math,fullMulDivInt256,24,32,,,safe,,,Verified production pure signed full precision multiplication and division helper with no judged-finding name overlap,true,accepted,exclude_project_from_kb_retrieval,accepted_v2_gold;assembled_from_phase2y_preview
lbe-curated-unified,freeze-candidate-20260628-phase2z,v2:phase2t:safe:006:2024-05-predy:Math.fullMulDivDownInt256,safe,v2,Phase 2T,2024-05-predy,code4rena,/Users/tonynguyen/Projects/poc_demo/data/knowledge_base/code4rena/2024-05-predy,,src/libraries/math/Math.sol,Math,fullMulDivDownInt256,34,42,,,safe,,,Verified production pure signed rounding-down multiplication and division helper with no judged-finding name overlap,true,accepted,exclude_project_from_kb_retrieval,accepted_v2_gold;assembled_from_phase2y_preview
lbe-curated-unified,freeze-candidate-20260628-phase2z,v2:phase2t:safe:007:2024-05-predy:Math.mulDivDownInt256,safe,v2,Phase 2T,2024-05-predy,code4rena,/Users/tonynguyen/Projects/poc_demo/data/knowledge_base/code4rena/2024-05-predy,,src/libraries/math/Math.sol,Math,mulDivDownInt256,44,52,,,safe,,,Verified production pure signed fixed-point multiplication and division helper with no judged-finding name overlap,true,accepted,exclude_project_from_kb_retrieval,accepted_v2_gold;assembled_from_phase2y_preview
lbe-curated-unified,freeze-candidate-20260628-phase2z,v2:phase2t:safe:008:2024-05-predy:Math.addDelta,safe,v2,Phase 2T,2024-05-predy,code4rena,/Users/tonynguyen/Projects/poc_demo/data/knowledge_base/code4rena/2024-05-predy,,src/libraries/math/Math.sol,Math,addDelta,54,60,,,safe,,,Verified production pure helper applying a signed delta to an unsigned value with no judged-finding name overlap,true,accepted,exclude_project_from_kb_retrieval,accepted_v2_gold;assembled_from_phase2y_preview
lbe-curated-unified,freeze-candidate-20260628-phase2z,v2:phase2t:safe:009:2024-06-krystal-defi:Common._getWeth9,safe,v2,Phase 2T,2024-06-krystal-defi,code4rena,/Users/tonynguyen/Projects/poc_demo/data/knowledge_base/code4rena/2024-06-krystal-defi,,src/Common.sol,Common,_getWeth9,630,638,,,safe,,,Verified production internal view helper selecting WETH or WNativeToken by protocol and not named in judged findings,true,accepted,exclude_project_from_kb_retrieval,accepted_v2_gold;assembled_from_phase2y_preview
lbe-curated-unified,freeze-candidate-20260628-phase2z,v2:phase2t:safe:010:2024-06-krystal-defi:Common.getMaxFeeX64,safe,v2,Phase 2T,2024-06-krystal-defi,code4rena,/Users/tonynguyen/Projects/poc_demo/data/knowledge_base/code4rena/2024-06-krystal-defi,,src/Common.sol,Common,getMaxFeeX64,709,710,,,safe,,,Verified production external view getter returning the configured max fee value and not named in judged findings,true,accepted,exclude_project_from_kb_retrieval,accepted_v2_gold;assembled_from_phase2y_preview
lbe-curated-unified,freeze-candidate-20260628-phase2z,v2:phase2t:safe:011:2024-06-krystal-defi:EIP712.toTypedDataHash,safe,v2,Phase 2T,2024-06-krystal-defi,code4rena,/Users/tonynguyen/Projects/poc_demo/data/knowledge_base/code4rena/2024-06-krystal-defi,,src/EIP712.sol,EIP712,toTypedDataHash,43,52,,,safe,,,Verified production pure EIP712 digest helper and not named as a judged vulnerable function,true,accepted,exclude_project_from_kb_retrieval,accepted_v2_gold;assembled_from_phase2y_preview
lbe-curated-unified,freeze-candidate-20260628-phase2z,v2:phase2t:safe:012:2024-06-krystal-defi:V3Automation.isOrderCancelled,safe,v2,Phase 2T,2024-06-krystal-defi,code4rena,/Users/tonynguyen/Projects/poc_demo/data/knowledge_base/code4rena/2024-06-krystal-defi,,src/V3Automation.sol,V3Automation,isOrderCancelled,182,184,,,safe,,,Verified production external view getter for cancellation status and not named as a judged vulnerable function,true,accepted,exclude_project_from_kb_retrieval,accepted_v2_gold;assembled_from_phase2y_preview
lbe-curated-unified,freeze-candidate-20260628-phase2z,v2:phase2t:safe:013:2024-07-karak:Core.isAssetAllowlisted,safe,v2,Phase 2T,2024-07-karak,code4rena,/Users/tonynguyen/Projects/poc_demo/data/knowledge_base/code4rena/2024-07-karak,,src/Core.sol,Core,isAssetAllowlisted,288,290,,,safe,,,Verified production view getter for asset allowlist status and not named in judged findings,true,accepted,exclude_project_from_kb_retrieval,accepted_v2_gold;assembled_from_phase2y_preview
lbe-curated-unified,freeze-candidate-20260628-phase2z,v2:phase2t:safe:014:2024-07-karak:Core.isVaultImplAllowListed,safe,v2,Phase 2T,2024-07-karak,code4rena,/Users/tonynguyen/Projects/poc_demo/data/knowledge_base/code4rena/2024-07-karak,,src/Core.sol,Core,isVaultImplAllowListed,294,296,,,safe,,,Verified production view getter for vault implementation allowlist status and not named in judged findings,true,accepted,exclude_project_from_kb_retrieval,accepted_v2_gold;assembled_from_phase2y_preview
lbe-curated-unified,freeze-candidate-20260628-phase2z,v2:phase2t:safe:015:2024-07-karak:Pauser.pausedMap,safe,v2,Phase 2T,2024-07-karak,code4rena,/Users/tonynguyen/Projects/poc_demo/data/knowledge_base/code4rena/2024-07-karak,,src/entities/Pauser.sol,Pauser,pausedMap,63,65,,,safe,,,Verified production view getter returning the pause bitmap with no judged-finding name overlap,true,accepted,exclude_project_from_kb_retrieval,accepted_v2_gold;assembled_from_phase2y_preview
lbe-curated-unified,freeze-candidate-20260628-phase2z,v2:phase2t:safe:016:2024-07-karak:CommonUtils.hasDuplicates,safe,v2,Phase 2T,2024-07-karak,code4rena,/Users/tonynguyen/Projects/poc_demo/data/knowledge_base/code4rena/2024-07-karak,,src/utils/CommonUtils.sol,CommonUtils,hasDuplicates,39,46,,,safe,,,Verified production pure address-array duplicate check helper with no judged-finding name overlap,true,accepted,exclude_project_from_kb_retrieval,accepted_v2_gold;assembled_from_phase2y_preview
lbe-curated-unified,freeze-candidate-20260628-phase2z,v2:phase2t:safe:017:2024-08-wildcat:WildcatMarketBase.version,safe,v2,Phase 2T,2024-08-wildcat,code4rena,/Users/tonynguyen/Projects/poc_demo/data/knowledge_base/code4rena/2024-08-wildcat,,src/market/WildcatMarketBase.sol,WildcatMarketBase,version,34,41,,,safe,,,Verified production pure getter returning the market contract version string and not named in judged findings,true,accepted,exclude_project_from_kb_retrieval,accepted_v2_gold;assembled_from_phase2y_preview
lbe-curated-unified,freeze-candidate-20260628-phase2z,v2:phase2t:safe:018:2024-08-wildcat:WildcatSanctionsSentinel.isFlaggedByChainalysis,safe,v2,Phase 2T,2024-08-wildcat,code4rena,/Users/tonynguyen/Projects/poc_demo/data/knowledge_base/code4rena/2024-08-wildcat,,src/WildcatSanctionsSentinel.sol,WildcatSanctionsSentinel,isFlaggedByChainalysis,77,79,,,safe,,,Verified production view sanctions-list helper and not named in judged H or M findings,true,accepted,exclude_project_from_kb_retrieval,accepted_v2_gold;assembled_from_phase2y_preview
lbe-curated-unified,freeze-candidate-20260628-phase2z,v2:phase2t:safe:019:2024-08-wildcat:WildcatSanctionsEscrow.escrowedAsset,safe,v2,Phase 2T,2024-08-wildcat,code4rena,/Users/tonynguyen/Projects/poc_demo/data/knowledge_base/code4rena/2024-08-wildcat,,src/WildcatSanctionsEscrow.sol,WildcatSanctionsEscrow,escrowedAsset,30,32,,,safe,,,Verified production view escrow asset getter and not named in judged H or M findings,true,accepted,exclude_project_from_kb_retrieval,accepted_v2_gold;assembled_from_phase2y_preview
lbe-curated-unified,freeze-candidate-20260628-phase2z,v2:phase2t:safe:020:2024-08-wildcat:WildcatMarketBase.previousState,safe,v2,Phase 2T,2024-08-wildcat,code4rena,/Users/tonynguyen/Projects/poc_demo/data/knowledge_base/code4rena/2024-08-wildcat,,src/market/WildcatMarketBase.sol,WildcatMarketBase,previousState,331,336,,,safe,,,Verified production view getter returning stored market state without mutating accounting and not named in judged findings,true,accepted,exclude_project_from_kb_retrieval,accepted_v2_gold;assembled_from_phase2y_preview
lbe-curated-unified,freeze-candidate-20260628-phase2z,v2:phase2u:vuln:001:2023-01-astaria:ClearingHouse._execute,vuln,v2,Phase 2U,2023-01-astaria,code4rena,/Users/tonynguyen/Projects/poc_demo/data/knowledge_base/code4rena/2023-01-astaria/findings/H-03.md,H-03.md,src/ClearingHouse.sol,ClearingHouse,_execute,114,167,Input Validation,SWC-123,high,ClearingHouse accepts the payment token decoded from untrusted metadata without validating it against the auction settlement token,Report H-03 describes improper ClearingHouse validation that can let a fake payment token path settle and lock collateral during liquidation processing,,true,accepted,exclude_project_from_kb_retrieval,accepted_v2_gold;assembled_from_phase2y_preview
lbe-curated-unified,freeze-candidate-20260628-phase2z,v2:phase2u:vuln:002:2023-01-astaria:Vault.withdraw,vuln,v2,Phase 2U,2023-01-astaria,code4rena,/Users/tonynguyen/Projects/poc_demo/data/knowledge_base/code4rena/2023-01-astaria/findings/H-04.md,H-04.md,src/Vault.sol,Vault,withdraw,70,73,Token Transfer Logic,SWC-123,high,Private vault withdrawal pulls tokens with safeTransferFrom from the vault itself instead of transferring the vault asset to the strategist owner,"Report H-04 maps the failed private-vault withdrawal to Vault.withdraw using safeTransferFrom(address(this), msg.sender, amount)",,true,accepted,exclude_project_from_kb_retrieval,accepted_v2_gold;assembled_from_phase2y_preview
lbe-curated-unified,freeze-candidate-20260628-phase2z,v2:phase2u:vuln:003:2023-01-astaria:ClearingHouse.settleLiquidatorNFTClaim,vuln,v2,Phase 2U,2023-01-astaria,code4rena,/Users/tonynguyen/Projects/poc_demo/data/knowledge_base/code4rena/2023-01-astaria/findings/H-05.md,H-05.md,src/ClearingHouse.sol,ClearingHouse,settleLiquidatorNFTClaim,220,231,Accounting Logic,SWC-123,high,Liquidator NFT claim settlement burns lien accounting with zero payment while collateral token state can remain claimable,Report H-05 states settleLiquidatorNFTClaim pays debt through the clearing house with zero amount during an expired no-bid liquidation claim,,true,accepted,exclude_project_from_kb_retrieval,accepted_v2_gold;assembled_from_phase2y_preview
lbe-curated-unified,freeze-candidate-20260628-phase2z,v2:phase2u:vuln:004:2023-01-astaria:AstariaRouter.isValidRefinance,vuln,v2,Phase 2U,2023-01-astaria,code4rena,/Users/tonynguyen/Projects/poc_demo/data/knowledge_base/code4rena/2023-01-astaria/findings/H-07.md,H-07.md,src/AstariaRouter.sol,AstariaRouter,isValidRefinance,684,703,Risk Validation,SWC-123,high,Refinance validation checks rate and duration but does not account for liquidationInitialAsk in the new lien terms,Report H-07 identifies AstariaRouter.isValidRefinance as allowing malicious refinancing that can make NFT liquidation suboptimal,,true,accepted,exclude_project_from_kb_retrieval,accepted_v2_gold;assembled_from_phase2y_preview
lbe-curated-unified,freeze-candidate-20260628-phase2z,v2:phase2u:vuln:005:2023-01-popcorn:MultiRewardStaking._accrueUser,vuln,v2,Phase 2U,2023-01-popcorn,code4rena,/Users/tonynguyen/Projects/poc_demo/data/knowledge_base/code4rena/2023-01-popcorn/findings/H-01.md,H-01.md,src/utils/MultiRewardStaking.sol,MultiRewardStaking,_accrueUser,413,432,Reward Accounting,SWC-123,high,User reward accrual calculates supplierDelta from the live user balance and reward index delta in a way that can over-credit rewards,Report H-01 states MultiRewardStaking can drain the reward fund due to incorrect supplierDelta calculation in _accrueUser,,true,accepted,exclude_project_from_kb_retrieval,accepted_v2_gold;assembled_from_phase2y_preview
lbe-curated-unified,freeze-candidate-20260628-phase2z,v2:phase2u:vuln:006:2023-01-popcorn:MultiRewardStaking.claimRewards,vuln,v2,Phase 2U,2023-01-popcorn,code4rena,/Users/tonynguyen/Projects/poc_demo/data/knowledge_base/code4rena/2023-01-popcorn/findings/H-04.md,H-04.md,src/utils/MultiRewardStaking.sol,MultiRewardStaking,claimRewards,170,188,Reward Accounting,SWC-123,high,Reward claiming transfers accrued reward amounts without a global claim-safety invariant that prevents reward-fund drain conditions,Report H-04 maps reward-drain behavior to MultiRewardStaking.claimRewards and its reward transfer loop,,true,accepted,exclude_project_from_kb_retrieval,accepted_v2_gold;assembled_from_phase2y_preview
lbe-curated-unified,freeze-candidate-20260628-phase2z,v2:phase2u:vuln:007:2023-01-popcorn:VaultController.pauseAdapters,vuln,v2,Phase 2U,2023-01-popcorn,code4rena,/Users/tonynguyen/Projects/poc_demo/data/knowledge_base/code4rena/2023-01-popcorn/findings/H-07.md,H-07.md,src/vault/VaultController.sol,VaultController,pauseAdapters,605,615,Access Control,SWC-105,high,Adapter pause authority depends on vault creator or controller owner checks that are shared across vaults using the same adapter,Report H-07 states anyone using the same adapter can pause it through VaultController.pauseAdapters after passing the flawed authorization path,,true,accepted,exclude_project_from_kb_retrieval,accepted_v2_gold;assembled_from_phase2y_preview
lbe-curated-unified,freeze-candidate-20260628-phase2z,v2:phase2u:vuln:008:2023-01-popcorn:VaultController._verifyCreatorOrOwner,vuln,v2,Phase 2U,2023-01-popcorn,code4rena,/Users/tonynguyen/Projects/poc_demo/data/knowledge_base/code4rena/2023-01-popcorn/findings/H-12.md,H-12.md,src/vault/VaultController.sol,VaultController,_verifyCreatorOrOwner,667,670,Access Control,SWC-105,high,Creator-or-owner authorization uses an OR condition inside a not-equal disjunction that rejects the intended authorized cases,Report H-12 identifies VaultController._verifyCreatorOrOwner as not working as intended because the caller check cannot satisfy creator-or-owner semantics,,true,accepted,exclude_project_from_kb_retrieval,accepted_v2_gold;assembled_from_phase2y_preview
lbe-curated-unified,freeze-candidate-20260628-phase2z,v2:phase2u:vuln:009:2023-02-ethos:StabilityPool.updateRewardSum,vuln,v2,Phase 2U,2023-02-ethos,code4rena,/Users/tonynguyen/Projects/poc_demo/data/knowledge_base/code4rena/2023-02-ethos/findings/H-01.md,H-01.md,Ethos-Core/contracts/StabilityPool.sol,StabilityPool,updateRewardSum,486,500,Reward Accounting,SWC-123,high,Reward-sum update distributes profit through StabilityPool math that can revert during vault allocation rebalancing,Report H-01 maps the rebalancing DoS during profit distribution to StabilityPool.updateRewardSum receiving ActivePool yield rewards,,true,accepted,exclude_project_from_kb_retrieval,accepted_v2_gold;assembled_from_phase2y_preview
lbe-curated-unified,freeze-candidate-20260628-phase2z,v2:phase2u:vuln:010:2023-02-ethos:ReaperVaultV2._withdraw,vuln,v2,Phase 2U,2023-02-ethos,code4rena,/Users/tonynguyen/Projects/poc_demo/data/knowledge_base/code4rena/2023-02-ethos/findings/H-02.md,H-02.md,Ethos-Vault/contracts/ReaperVaultV2.sol,ReaperVaultV2,_withdraw,359,412,Withdrawal Accounting,SWC-123,high,Withdrawal burns shares before constrained strategy withdrawals can reveal that less value is available than expected,Report H-02 states users can lose up to their whole stake on vault withdrawal when funds are locked in strategy and maps the issue to ReaperVaultV2._withdraw,,true,accepted,exclude_project_from_kb_retrieval,accepted_v2_gold;assembled_from_phase2y_preview
lbe-curated-unified,freeze-candidate-20260628-phase2z,v2:phase2u:vuln:011:2023-02-ethos:LQTYStaking.increaseF_Collateral,vuln,v2,Phase 2U,2023-02-ethos,code4rena,/Users/tonynguyen/Projects/poc_demo/data/knowledge_base/code4rena/2023-02-ethos/findings/H-03.md,H-03.md,Ethos-Core/contracts/LQTY/LQTYStaking.sol,LQTYStaking,increaseF_Collateral,177,185,Reward Distribution,SWC-123,high,Collateral reward accounting only updates collateral fee sums and can leave distributed rewards locked in the staking contract path,Report H-03 states rewards can remain locked in LQTYStaking and references increaseF_Collateral in the reward distribution flow,,true,accepted,exclude_project_from_kb_retrieval,accepted_v2_gold;assembled_from_phase2y_preview
lbe-curated-unified,freeze-candidate-20260628-phase2z,v2:phase2u:vuln:012:2023-02-ethos:ActivePool._rebalance,vuln,v2,Phase 2U,2023-02-ethos,code4rena,/Users/tonynguyen/Projects/poc_demo/data/knowledge_base/code4rena/2023-02-ethos/findings/M-06.md,M-06.md,Ethos-Core/contracts/ActivePool.sol,ActivePool,_rebalance,239,309,Liquidity Availability,SWC-123,medium,ActivePool rebalancing assumes yield-generator liquidity is available and can deny liquidations or redemptions when collateral reserves are borrowed out,Report M-06 describes denial of liquidations and redemptions by borrowing reserves from AAVE and maps the reserve movement to ActivePool._rebalance,,true,accepted,exclude_project_from_kb_retrieval,accepted_v2_gold;assembled_from_phase2y_preview
lbe-curated-unified,freeze-candidate-20260628-phase2z,v2:phase2u:vuln:013:2023-02-malt:RewardThrottle.checkRewardUnderflow,vuln,v2,Phase 2U,2023-02-malt,code4rena,/Users/tonynguyen/Projects/poc_demo/data/knowledge_base/code4rena/2023-02-malt/findings/H-01.md,H-01.md,contracts/RewardSystem/RewardThrottle.sol,RewardThrottle,checkRewardUnderflow,437,456,Reward Accounting,SWC-123,high,Reward-underflow tracking iterates epochs and distributes requested capital using cumulative APR state that can be tracked incorrectly,Report H-01 identifies RewardThrottle.checkRewardUnderflow as tracking cumulative APRs wrongly when filling reward underflow,,true,accepted,exclude_project_from_kb_retrieval,accepted_v2_gold;assembled_from_phase2y_preview
