dataset_id,dataset_version,row_id,row_type,source_set,source_phase_or_file,project_slug,source_origin,source_url_or_report_url,report_evidence,source_path,contract,function,original_line_start,original_line_end,category,swc_id,severity,expected_root_cause,evidence_summary,safe_selection_reason,human_verified,verification_status,leakage_policy,provenance_notes
lbe-curated-unified,freeze-candidate-20260628-phase2z,v2:phase2q:vuln:008:2021-08-notional:nTokenERC20Proxy.transfer,vuln,v2,Phase 2Q,2021-08-notional,code4rena,/Users/tonynguyen/Projects/poc_demo/data/knowledge_base/code4rena/2021-08-notional/findings/M-05.md,M-05.md,contracts/external/adapters/nTokenERC20Proxy.sol,nTokenERC20Proxy,transfer,78,82,Event Integrity,SWC-135,medium,Transfer event is emitted before checking whether the proxied transfer succeeded,Report M-05 shows nTokenERC20Proxy can emit Transfer even when the inner call returns false,,true,accepted,exclude_project_from_kb_retrieval,accepted_v2_gold;assembled_from_phase2y_preview
lbe-curated-unified,freeze-candidate-20260628-phase2z,v2:phase2q:vuln:009:2021-06-realitycards:RCTreasury.topupMarketBalance,vuln,v2,Phase 2Q,2021-06-realitycards,code4rena,/Users/tonynguyen/Projects/poc_demo/data/knowledge_base/code4rena/2021-06-realitycards/findings/H-01.md,H-01.md,contracts/RCTreasury.sol,RCTreasury,topupMarketBalance,372,380,Unchecked Token Transfer,SWC-104,high,Market balance topup calls ERC20 transferFrom without balancedBooks or SafeERC20 style success handling,Report H-01 shows failing ERC20 transfers can inflate marketBalance and lock the treasury,,true,accepted,exclude_project_from_kb_retrieval,accepted_v2_gold;assembled_from_phase2y_preview
lbe-curated-unified,freeze-candidate-20260628-phase2z,v2:phase2q:vuln:010:2021-06-realitycards:RCMarket.ownerOf,vuln,v2,Phase 2Q,2021-06-realitycards,code4rena,/Users/tonynguyen/Projects/poc_demo/data/knowledge_base/code4rena/2021-06-realitycards/findings/H-02.md,H-02.md,contracts/RCMarket.sol,RCMarket,ownerOf,338,340,Input Validation,SWC-123,high,Card ownership lookup does not validate that the card id is inside the market card range,Report H-02 shows ownerOf can resolve token ids from other markets because cardId is unchecked,,true,accepted,exclude_project_from_kb_retrieval,accepted_v2_gold;assembled_from_phase2y_preview
lbe-curated-unified,freeze-candidate-20260628-phase2z,v2:phase2q:vuln:011:2021-06-realitycards:RCMarket.sponsor,vuln,v2,Phase 2Q,2021-06-realitycards,code4rena,/Users/tonynguyen/Projects/poc_demo/data/knowledge_base/code4rena/2021-06-realitycards/findings/H-03.md,H-03.md,contracts/RCMarket.sol,RCMarket,sponsor,817,822,Access Control,SWC-105,high,Factory intended sponsor entry point lacks caller authorization and accepts arbitrary sponsor addresses,Report H-03 shows anyone can call sponsor with another address and pull approved funds,,true,accepted,exclude_project_from_kb_retrieval,accepted_v2_gold;assembled_from_phase2y_preview
lbe-curated-unified,freeze-candidate-20260628-phase2z,v2:phase2q:vuln:012:2021-06-realitycards:RCTreasury.collectRentUser,vuln,v2,Phase 2Q,2021-06-realitycards,code4rena,/Users/tonynguyen/Projects/poc_demo/data/knowledge_base/code4rena/2021-06-realitycards/findings/H-04.md,H-04.md,contracts/RCTreasury.sol,RCTreasury,collectRentUser,703,724,Access Control,SWC-105,high,Public rent collection accepts arbitrary future timestamps for any user,Report H-04 shows collectRentUser can foreclose users by collecting rent to a max timestamp,,true,accepted,exclude_project_from_kb_retrieval,accepted_v2_gold;assembled_from_phase2y_preview
lbe-curated-unified,freeze-candidate-20260628-phase2z,v2:phase2q:vuln:013:2024-09-fenix-finance:VoterUpgradeableV2.killGauge,vuln,v2,Phase 2Q,2024-09-fenix-finance,code4rena,/Users/tonynguyen/Projects/poc_demo/data/knowledge_base/code4rena/2024-09-fenix-finance/findings/H-01.md,H-01.md,contracts/core/VoterUpgradeableV2.sol,VoterUpgradeableV2,killGauge,227,240,Accounting,SWC-135,high,Killing a gauge subtracts total epoch weight without clearing the gauge pool weight used during distribution,Report H-01 shows killGauge breaks emission accounting for killed and later distributed gauges,,true,accepted,exclude_project_from_kb_retrieval,accepted_v2_gold;assembled_from_phase2y_preview
lbe-curated-unified,freeze-candidate-20260628-phase2z,v2:phase2q:vuln:014:2024-09-fenix-finance:VoterUpgradeableV2.attachToManagedNFT,vuln,v2,Phase 2Q,2024-09-fenix-finance,code4rena,/Users/tonynguyen/Projects/poc_demo/data/knowledge_base/code4rena/2024-09-fenix-finance/findings/M-01.md,M-01.md,contracts/core/VoterUpgradeableV2.sol,VoterUpgradeableV2,attachToManagedNFT,539,544,Denial of Service,SWC-113,medium,Attaching to a managed NFT calls _poke and updates vote delay for the managed token,Report M-01 shows attachToManagedNFT can repeatedly block managed NFT voting during epochs,,true,accepted,exclude_project_from_kb_retrieval,accepted_v2_gold;assembled_from_phase2y_preview
lbe-curated-unified,freeze-candidate-20260628-phase2z,v2:phase2q:vuln:015:2024-09-fenix-finance:VoterUpgradeableV2.createV3Gauge,vuln,v2,Phase 2Q,2024-09-fenix-finance,code4rena,/Users/tonynguyen/Projects/poc_demo/data/knowledge_base/code4rena/2024-09-fenix-finance/findings/M-02.md,M-02.md,contracts/core/VoterUpgradeableV2.sol,VoterUpgradeableV2,createV3Gauge,308,336,Configuration Error,SWC-135,medium,V3 gauge creation calls the V2 gauge factory rather than the V3 factory,Report M-02 shows createV3Gauge wires v3 pools through v2GaugeFactory,,true,accepted,exclude_project_from_kb_retrieval,accepted_v2_gold;assembled_from_phase2y_preview
lbe-curated-unified,freeze-candidate-20260628-phase2z,v2:phase2q:vuln:016:2024-09-fenix-finance:VotingEscrowUpgradeableV2._proccessLockChange,vuln,v2,Phase 2Q,2024-09-fenix-finance,code4rena,/Users/tonynguyen/Projects/poc_demo/data/knowledge_base/code4rena/2024-09-fenix-finance/findings/M-04.md,M-04.md,contracts/core/VotingEscrowUpgradeableV2.sol,VotingEscrowUpgradeableV2,_proccessLockChange,437,470,Accounting,SWC-101,medium,Permanent total supply adds only deposited amount and omits boost value for permanent locks,Report M-04 maps the lock-change path to permanentTotalSupply undercounting and later unlock blocking,,true,accepted,exclude_project_from_kb_retrieval,accepted_v2_gold;assembled_from_phase2y_preview
lbe-curated-unified,freeze-candidate-20260628-phase2z,v2:phase2q:vuln:017:2024-10-loopfi:RewardManager._updateRewardIndex,vuln,v2,Phase 2Q,2024-10-loopfi,code4rena,/Users/tonynguyen/Projects/poc_demo/data/knowledge_base/code4rena/2024-10-loopfi/findings/H-01.md,H-01.md,src/pendle-rewards/RewardManager.sol,RewardManager,_updateRewardIndex,44,79,Precision Loss,SWC-101,high,Reward balance advances even when rounded reward index delta is zero,Report H-01 shows _updateRewardIndex can lose small accrued rewards by updating lastBalance without index movement,,true,accepted,exclude_project_from_kb_retrieval,accepted_v2_gold;assembled_from_phase2y_preview
lbe-curated-unified,freeze-candidate-20260628-phase2z,v2:phase2q:vuln:018:2024-10-loopfi:CDPVault.liquidatePositionBadDebt,vuln,v2,Phase 2Q,2024-10-loopfi,code4rena,/Users/tonynguyen/Projects/poc_demo/data/knowledge_base/code4rena/2024-10-loopfi/findings/H-02.md,H-02.md,src/CDPVault.sol,CDPVault,liquidatePositionBadDebt,653,702,Accounting,SWC-135,high,Bad debt liquidation computes profit and loss inconsistently before pool repayment accounting,Report H-02 shows liquidatePositionBadDebt passes incorrect profit and loss values to pool repayment,,true,accepted,exclude_project_from_kb_retrieval,accepted_v2_gold;assembled_from_phase2y_preview
lbe-curated-unified,freeze-candidate-20260628-phase2z,v2:phase2q:vuln:019:2024-10-loopfi:PositionAction.onCreditFlashLoan,vuln,v2,Phase 2Q,2024-10-loopfi,code4rena,/Users/tonynguyen/Projects/poc_demo/data/knowledge_base/code4rena/2024-10-loopfi/findings/M-01.md,M-01.md,src/proxy/PositionAction.sol,PositionAction,onCreditFlashLoan,453,528,Flash Loan,SWC-135,medium,Credit flash loan callback repays subDebt without reserving the fee in debt reduction,Report M-01 shows onCreditFlashLoan can revert when flash loan fees are positive,,true,accepted,exclude_project_from_kb_retrieval,accepted_v2_gold;assembled_from_phase2y_preview
lbe-curated-unified,freeze-candidate-20260628-phase2z,v2:phase2q:vuln:020:2024-10-loopfi:PositionAction4626._onWithdraw,vuln,v2,Phase 2Q,2024-10-loopfi,code4rena,/Users/tonynguyen/Projects/poc_demo/data/knowledge_base/code4rena/2024-10-loopfi/findings/M-03.md,M-03.md,src/proxy/PositionAction4626.sol,PositionAction4626,_onWithdraw,61,75,Authorization Flow,SWC-105,medium,ERC4626 withdraw hook withdraws from this contract instead of the user position,Report M-03 shows _onWithdraw targets address(this) rather than the supplied position,,true,accepted,exclude_project_from_kb_retrieval,accepted_v2_gold;assembled_from_phase2y_preview
lbe-curated-unified,freeze-candidate-20260628-phase2z,v2:phase2q:safe:001:2021-04-vader:Pools.isMember,safe,v2,Phase 2Q,2021-04-vader,code4rena,/Users/tonynguyen/Projects/poc_demo/data/knowledge_base/code4rena/2021-04-vader,,vader-protocol/contracts/Pools.sol,Pools,isMember,215,217,,,safe,,,Verified production view getter that only returns membership mapping state and has no judged-finding name overlap,true,accepted,exclude_project_from_kb_retrieval,accepted_v2_gold;assembled_from_phase2y_preview
lbe-curated-unified,freeze-candidate-20260628-phase2z,v2:phase2q:safe:002:2021-04-vader:Pools.getUnits,safe,v2,Phase 2Q,2021-04-vader,code4rena,/Users/tonynguyen/Projects/poc_demo/data/knowledge_base/code4rena/2021-04-vader,,vader-protocol/contracts/Pools.sol,Pools,getUnits,233,235,,,safe,,,Verified production view getter that only returns pool unit accounting and has no judged-finding name overlap,true,accepted,exclude_project_from_kb_retrieval,accepted_v2_gold;assembled_from_phase2y_preview
lbe-curated-unified,freeze-candidate-20260628-phase2z,v2:phase2q:safe:003:2021-04-vader:Utils.calcPart,safe,v2,Phase 2Q,2021-04-vader,code4rena,/Users/tonynguyen/Projects/poc_demo/data/knowledge_base/code4rena/2021-04-vader,,vader-protocol/contracts/Utils.sol,Utils,calcPart,195,199,,,safe,,,Verified production pure helper that converts basis points to a share and has no judged-finding name overlap,true,accepted,exclude_project_from_kb_retrieval,accepted_v2_gold;assembled_from_phase2y_preview
lbe-curated-unified,freeze-candidate-20260628-phase2z,v2:phase2q:safe:004:2021-04-vader:Router.emitting,safe,v2,Phase 2Q,2021-04-vader,code4rena,/Users/tonynguyen/Projects/poc_demo/data/knowledge_base/code4rena/2021-04-vader,,vader-protocol/contracts/Router.sol,Router,emitting,470,472,,,safe,,,Verified production view getter that only returns Vader emission status and has no judged-finding name overlap,true,accepted,exclude_project_from_kb_retrieval,accepted_v2_gold;assembled_from_phase2y_preview
lbe-curated-unified,freeze-candidate-20260628-phase2z,v2:phase2q:safe:005:2021-08-notional:Views.getMaxCurrencyId,safe,v2,Phase 2Q,2021-08-notional,code4rena,/Users/tonynguyen/Projects/poc_demo/data/knowledge_base/code4rena/2021-08-notional,,contracts/external/Views.sol,Views,getMaxCurrencyId,30,32,,,safe,,,Verified production view getter that only returns max currency id and has no judged-finding name overlap,true,accepted,exclude_project_from_kb_retrieval,accepted_v2_gold;assembled_from_phase2y_preview
lbe-curated-unified,freeze-candidate-20260628-phase2z,v2:phase2q:safe:006:2021-08-notional:Views.getCashGroup,safe,v2,Phase 2Q,2021-08-notional,code4rena,/Users/tonynguyen/Projects/poc_demo/data/knowledge_base/code4rena/2021-08-notional,,contracts/external/Views.sol,Views,getCashGroup,87,94,,,safe,,,Verified production view getter that deserializes stored cash group settings and has no judged-finding name overlap,true,accepted,exclude_project_from_kb_retrieval,accepted_v2_gold;assembled_from_phase2y_preview
lbe-curated-unified,freeze-candidate-20260628-phase2z,v2:phase2q:safe:007:2021-08-notional:Views.getOwner,safe,v2,Phase 2Q,2021-08-notional,code4rena,/Users/tonynguyen/Projects/poc_demo/data/knowledge_base/code4rena/2021-08-notional,,contracts/external/Views.sol,Views,getOwner,141,143,,,safe,,,Verified production view getter that only returns the owner address and has no judged-finding name overlap,true,accepted,exclude_project_from_kb_retrieval,accepted_v2_gold;assembled_from_phase2y_preview
lbe-curated-unified,freeze-candidate-20260628-phase2z,v2:phase2q:safe:008:2021-08-notional:Views.getReserveBalance,safe,v2,Phase 2Q,2021-08-notional,code4rena,/Users/tonynguyen/Projects/poc_demo/data/knowledge_base/code4rena/2021-08-notional,,contracts/external/Views.sol,Views,getReserveBalance,195,208,,,safe,,,Verified production view getter that reads reserve balance storage and has no judged-finding name overlap,true,accepted,exclude_project_from_kb_retrieval,accepted_v2_gold;assembled_from_phase2y_preview
lbe-curated-unified,freeze-candidate-20260628-phase2z,v2:phase2q:safe:009:2021-06-realitycards:RCFactory.getPotDistribution,safe,v2,Phase 2Q,2021-06-realitycards,code4rena,/Users/tonynguyen/Projects/poc_demo/data/knowledge_base/code4rena/2021-06-realitycards,,contracts/RCFactory.sol,RCFactory,getPotDistribution,168,175,,,safe,,,Verified production view getter that returns pot distribution configuration and has no judged-finding name overlap,true,accepted,exclude_project_from_kb_retrieval,accepted_v2_gold;assembled_from_phase2y_preview
lbe-curated-unified,freeze-candidate-20260628-phase2z,v2:phase2q:safe:010:2021-06-realitycards:RCFactory.getOracleSettings,safe,v2,Phase 2Q,2021-06-realitycards,code4rena,/Users/tonynguyen/Projects/poc_demo/data/knowledge_base/code4rena/2021-06-realitycards,,contracts/RCFactory.sol,RCFactory,getOracleSettings,617,628,,,safe,,,Verified production view getter that returns oracle configuration values and has no judged-finding name overlap,true,accepted,exclude_project_from_kb_retrieval,accepted_v2_gold;assembled_from_phase2y_preview
lbe-curated-unified,freeze-candidate-20260628-phase2z,v2:phase2q:safe:011:2021-06-realitycards:RCTreasury.userTotalBids,safe,v2,Phase 2Q,2021-06-realitycards,code4rena,/Users/tonynguyen/Projects/poc_demo/data/knowledge_base/code4rena/2021-06-realitycards,,contracts/RCTreasury.sol,RCTreasury,userTotalBids,506,513,,,safe,,,Verified production view getter that returns a user bid-rate aggregate and has no judged-finding name overlap,true,accepted,exclude_project_from_kb_retrieval,accepted_v2_gold;assembled_from_phase2y_preview
lbe-curated-unified,freeze-candidate-20260628-phase2z,v2:phase2q:safe:012:2021-06-realitycards:RCTreasury.userDeposit,safe,v2,Phase 2Q,2021-06-realitycards,code4rena,/Users/tonynguyen/Projects/poc_demo/data/knowledge_base/code4rena/2021-06-realitycards,,contracts/RCTreasury.sol,RCTreasury,userDeposit,517,524,,,safe,,,Verified production view getter that returns a user deposit balance and has no judged-finding name overlap,true,accepted,exclude_project_from_kb_retrieval,accepted_v2_gold;assembled_from_phase2y_preview
lbe-curated-unified,freeze-candidate-20260628-phase2z,v2:phase2q:safe:013:2024-09-fenix-finance:BribeFactoryUpgradeable.getDefaultRewardTokens,safe,v2,Phase 2Q,2024-09-fenix-finance,code4rena,/Users/tonynguyen/Projects/poc_demo/data/knowledge_base/code4rena/2024-09-fenix-finance,,contracts/bribes/BribeFactoryUpgradeable.sol,BribeFactoryUpgradeable,getDefaultRewardTokens,109,119,,,safe,,,Verified production view getter that copies configured default reward tokens and has no judged-finding name overlap,true,accepted,exclude_project_from_kb_retrieval,accepted_v2_gold;assembled_from_phase2y_preview
lbe-curated-unified,freeze-candidate-20260628-phase2z,v2:phase2q:safe:014:2024-09-fenix-finance:BribeUpgradeable.rewardsListLength,safe,v2,Phase 2Q,2024-09-fenix-finance,code4rena,/Users/tonynguyen/Projects/poc_demo/data/knowledge_base/code4rena/2024-09-fenix-finance,,contracts/bribes/BribeUpgradeable.sol,BribeUpgradeable,rewardsListLength,81,83,,,safe,,,Verified production view getter that only returns reward token list length and has no judged-finding name overlap,true,accepted,exclude_project_from_kb_retrieval,accepted_v2_gold;assembled_from_phase2y_preview
lbe-curated-unified,freeze-candidate-20260628-phase2z,v2:phase2q:safe:015:2024-09-fenix-finance:VeBoostUpgradeable.getBoostFNXPercentage,safe,v2,Phase 2Q,2024-09-fenix-finance,code4rena,/Users/tonynguyen/Projects/poc_demo/data/knowledge_base/code4rena/2024-09-fenix-finance,,contracts/core/VeBoostUpgradeable.sol,VeBoostUpgradeable,getBoostFNXPercentage,268,270,,,safe,,,Verified production view getter that returns configured boost percentage and has no judged-finding name overlap,true,accepted,exclude_project_from_kb_retrieval,accepted_v2_gold;assembled_from_phase2y_preview
lbe-curated-unified,freeze-candidate-20260628-phase2z,v2:phase2q:safe:016:2024-09-fenix-finance:VeBoostUpgradeable.getAvailableBoostFNXAmount,safe,v2,Phase 2Q,2024-09-fenix-finance,code4rena,/Users/tonynguyen/Projects/poc_demo/data/knowledge_base/code4rena/2024-09-fenix-finance,,contracts/core/VeBoostUpgradeable.sol,VeBoostUpgradeable,getAvailableBoostFNXAmount,276,281,,,safe,,,Verified production view helper that returns available boost allowance bounded by balance and has no judged-finding name overlap,true,accepted,exclude_project_from_kb_retrieval,accepted_v2_gold;assembled_from_phase2y_preview
lbe-curated-unified,freeze-candidate-20260628-phase2z,v2:phase2q:safe:017:2024-10-loopfi:Flashlender.maxFlashLoan,safe,v2,Phase 2Q,2024-10-loopfi,code4rena,/Users/tonynguyen/Projects/poc_demo/data/knowledge_base/code4rena/2024-10-loopfi,,src/Flashlender.sol,Flashlender,maxFlashLoan,64,68,,,safe,,,Verified production view getter that computes borrowable flash loan capacity and has no judged-finding name overlap,true,accepted,exclude_project_from_kb_retrieval,accepted_v2_gold;assembled_from_phase2y_preview
lbe-curated-unified,freeze-candidate-20260628-phase2z,v2:phase2q:safe:018:2024-10-loopfi:Flashlender.flashFee,safe,v2,Phase 2Q,2024-10-loopfi,code4rena,/Users/tonynguyen/Projects/poc_demo/data/knowledge_base/code4rena/2024-10-loopfi,,src/Flashlender.sol,Flashlender,flashFee,75,78,,,safe,,,Verified production view getter that computes protocol flash fee and has no judged-finding name overlap,true,accepted,exclude_project_from_kb_retrieval,accepted_v2_gold;assembled_from_phase2y_preview
lbe-curated-unified,freeze-candidate-20260628-phase2z,v2:phase2q:safe:019:2024-10-loopfi:VaultRegistry.getVaults,safe,v2,Phase 2Q,2024-10-loopfi,code4rena,/Users/tonynguyen/Projects/poc_demo/data/knowledge_base/code4rena/2024-10-loopfi,,src/VaultRegistry.sol,VaultRegistry,getVaults,59,61,,,safe,,,Verified production view getter that returns the registered vault list and has no judged-finding name overlap,true,accepted,exclude_project_from_kb_retrieval,accepted_v2_gold;assembled_from_phase2y_preview
lbe-curated-unified,freeze-candidate-20260628-phase2z,v2:phase2q:safe:020:2024-10-loopfi:PoolV3.availableLiquidity,safe,v2,Phase 2Q,2024-10-loopfi,code4rena,/Users/tonynguyen/Projects/poc_demo/data/knowledge_base/code4rena/2024-10-loopfi,,src/PoolV3.sol,PoolV3,availableLiquidity,201,203,,,safe,,,Verified production view getter that returns current underlying token balance and has no judged-finding name overlap,true,accepted,exclude_project_from_kb_retrieval,accepted_v2_gold;assembled_from_phase2y_preview
lbe-curated-unified,freeze-candidate-20260628-phase2z,v2:phase2r:vuln:001:2024-08-axelar-network:InterchainTokenService.deployInterchainToken,vuln,v2,Phase 2R,2024-08-axelar-network,code4rena,/Users/tonynguyen/Projects/poc_demo/data/knowledge_base/code4rena/2024-08-axelar-network/findings/H-02.md,H-02.md,interchain-token-service/contracts/InterchainTokenService.sol,InterchainTokenService,deployInterchainToken,327,348,Cross Chain Accounting,SWC-135,high,Remote token deployment can initialize original chain balance state in a way that blocks or limits bridge flow,Report H-02 maps the bridge blocking issue to deployInterchainToken and related token deployment flow,,true,accepted,exclude_project_from_kb_retrieval,accepted_v2_gold;assembled_from_phase2y_preview
lbe-curated-unified,freeze-candidate-20260628-phase2z,v2:phase2r:vuln:002:2024-08-axelar-network:TokenHandler.takeToken,vuln,v2,Phase 2R,2024-08-axelar-network,code4rena,/Users/tonynguyen/Projects/poc_demo/data/knowledge_base/code4rena/2024-08-axelar-network/findings/M-01.md,M-01.md,interchain-token-service/contracts/TokenHandler.sol,TokenHandler,takeToken,91,122,Accounting,SWC-135,medium,Bridge accounting tracks requested token amount rather than balance delta for rebasing token flows,Report M-01 shows takeToken can record stale flow amounts for rebasing tokens during lock unlock transfers,,true,accepted,exclude_project_from_kb_retrieval,accepted_v2_gold;assembled_from_phase2y_preview
lbe-curated-unified,freeze-candidate-20260628-phase2z,v2:phase2r:vuln:003:2024-10-kleidi:Timelock.schedule,vuln,v2,Phase 2R,2024-10-kleidi,code4rena,/Users/tonynguyen/Projects/poc_demo/data/knowledge_base/code4rena/2024-10-kleidi/findings/M-01.md,M-01.md,src/Timelock.sol,Timelock,schedule,521,539,Denial of Service,SWC-113,medium,Proposal scheduling stores every live proposal id and forces pause recovery to clear them individually,Report M-01 shows schedule can be abused to create many live proposals and cause gas griefing,,true,accepted,exclude_project_from_kb_retrieval,accepted_v2_gold;assembled_from_phase2y_preview
lbe-curated-unified,freeze-candidate-20260628-phase2z,v2:phase2r:vuln:004:2024-10-kleidi:BytesHelper.sliceBytes,vuln,v2,Phase 2R,2024-10-kleidi,code4rena,/Users/tonynguyen/Projects/poc_demo/data/knowledge_base/code4rena/2024-10-kleidi/findings/M-02.md,M-02.md,src/BytesHelper.sol,BytesHelper,sliceBytes,35,58,Input Validation,SWC-123,medium,Calldata slicing treats the end index as exclusive while callers reason about inclusive byte ranges,Report M-02 shows sliceBytes index handling can reject valid calldata checks,,true,accepted,exclude_project_from_kb_retrieval,accepted_v2_gold;assembled_from_phase2y_preview
lbe-curated-unified,freeze-candidate-20260628-phase2z,v2:phase2r:vuln:005:2024-10-kleidi:Timelock._afterCall,vuln,v2,Phase 2R,2024-10-kleidi,code4rena,/Users/tonynguyen/Projects/poc_demo/data/knowledge_base/code4rena/2024-10-kleidi/findings/M-03.md,M-03.md,src/Timelock.sol,Timelock,_afterCall,1009,1015,Timelock Logic,SWC-135,medium,Post execution readiness check uses updated expiration timing and can reject valid expiration-period updates,Report M-03 shows _afterCall can block UpdateExpirationPeriod when the new period is shorter,,true,accepted,exclude_project_from_kb_retrieval,accepted_v2_gold;assembled_from_phase2y_preview
lbe-curated-unified,freeze-candidate-20260628-phase2z,v2:phase2r:vuln:006:2024-10-ramses-exchange:Oracle.periodCumulativesInside,vuln,v2,Phase 2R,2024-10-ramses-exchange,code4rena,/Users/tonynguyen/Projects/poc_demo/data/knowledge_base/code4rena/2024-10-ramses-exchange/findings/M-01.md,M-01.md,contracts/CL/core/libraries/Oracle.sol,Oracle,periodCumulativesInside,470,530,Accounting,SWC-135,medium,Skipped period cumulative accounting can inflate GaugeV3 rewards when later periods are cached,Report M-01 shows periodCumulativesInside can return cumulative data that inflates skipped-period gauge rewards,,true,accepted,exclude_project_from_kb_retrieval,accepted_v2_gold;assembled_from_phase2y_preview
lbe-curated-unified,freeze-candidate-20260628-phase2z,v2:phase2r:vuln:007:2024-10-ramses-exchange:RamsesV3Pool.flash,vuln,v2,Phase 2R,2024-10-ramses-exchange,code4rena,/Users/tonynguyen/Projects/poc_demo/data/knowledge_base/code4rena/2024-10-ramses-exchange/findings/M-02.md,M-02.md,contracts/CL/core/RamsesV3Pool.sol,RamsesV3Pool,flash,684,725,Fee Logic,SWC-135,medium,Protocol flash fee share divides by feeProtocol directly instead of the intended fee denominator semantics,Report M-02 shows flash calculates protocol fees incorrectly when collecting flash loan fees,,true,accepted,exclude_project_from_kb_retrieval,accepted_v2_gold;assembled_from_phase2y_preview
lbe-curated-unified,freeze-candidate-20260628-phase2z,v2:phase2r:vuln:008:2024-11-ethena-labs:UStb._beforeTokenTransfer,vuln,v2,Phase 2R,2024-11-ethena-labs,code4rena,/Users/tonynguyen/Projects/poc_demo/data/knowledge_base/code4rena/2024-11-ethena-labs/findings/M-01.md,M-01.md,contracts/ustb/UStb.sol,UStb,_beforeTokenTransfer,165,213,Access Control,SWC-105,medium,Whitelist transfer hook allows a blacklisted user path to burn during whitelist-enabled state,Report M-01 shows _beforeTokenTransfer permits blacklisted burn flow when whitelist mode is active,,true,accepted,exclude_project_from_kb_retrieval,accepted_v2_gold;assembled_from_phase2y_preview
lbe-curated-unified,freeze-candidate-20260628-phase2z,v2:phase2r:vuln:009:2024-11-ethena-labs:UStb._beforeTokenTransfer,vuln,v2,Phase 2R,2024-11-ethena-labs,code4rena,/Users/tonynguyen/Projects/poc_demo/data/knowledge_base/code4rena/2024-11-ethena-labs/findings/M-02.md,M-02.md,contracts/ustb/UStb.sol,UStb,_beforeTokenTransfer,165,213,Access Control,SWC-105,medium,Whitelist transfer hook checks the minter role path without requiring the source address to be whitelisted,Report M-02 shows _beforeTokenTransfer can allow non-whitelisted redemption burn during whitelist mode,,true,accepted,exclude_project_from_kb_retrieval,accepted_v2_gold;assembled_from_phase2y_preview
